{
  "task_id": "task-05E37A11",
  "executed_at": "2026-04-15T19:10:12Z",
  "branch_name": "task/task-05E37A11/develop-and-test-a-python-factorial-function",
  "steps_completed": [
    {
      "step_id": 1,
      "status": "completed",
      "output": "Written 1795 chars to factorial.py",
      "error": null
    },
    {
      "step_id": 2,
      "status": "completed",
      "output": "Written 1654 chars to test_factorial.py",
      "error": null
    },
    {
      "step_id": 3,
      "status": "failed",
      "output": "\nSTDERR: 'pytest' is not recognized as an internal or external command,\noperable program or batch file.\n",
      "error": "Exit code 1"
    },
    {
      "step_id": 4,
      "status": "completed",
      "output": "Written 1901 chars to factorial.py",
      "error": null
    },
    {
      "step_id": 5,
      "status": "failed",
      "output": "\nSTDERR: 'pytest' is not recognized as an internal or external command,\noperable program or batch file.\n",
      "error": "Exit code 1"
    },
    {
      "step_id": 6,
      "status": "completed",
      "output": "Written 3722 chars to factorial.py",
      "error": null
    }
  ],
  "files_created": [
    "factorial.py",
    "test_factorial.py"
  ],
  "files_modified": [
    "factorial.py",
    "factorial.py"
  ],
  "summary": "Executed 4 of 6 steps. Created: 2 files. Modified: 2 files. Issues: 2.",
  "issues_encountered": [
    "Step 3: Exit code 1",
    "Step 5: Exit code 1"
  ]
}