{
  "task_id": "task-9B4EDFFC",
  "executed_at": "2026-04-15T14:15:20Z",
  "branch_name": "task/task-9B4EDFFC/fix-executor-environment-and-revision-handling",
  "steps_completed": [
    {
      "step_id": 1,
      "status": "completed",
      "output": "Written 4044 chars to executor.py",
      "error": null
    },
    {
      "step_id": 2,
      "status": "completed",
      "output": "Written 4221 chars to executor.py",
      "error": null
    },
    {
      "step_id": 3,
      "status": "completed",
      "output": "Written 4446 chars to revision_handler.py",
      "error": null
    },
    {
      "step_id": 4,
      "status": "failed",
      "output": "\nSTDERR: C:\\Users\\evhedric\\AppData\\Local\\Python\\pythoncore-3.14-64\\python.exe: No module named pytest\n",
      "error": "Exit code 1"
    }
  ],
  "files_created": [],
  "files_modified": [
    "executor.py",
    "executor.py",
    "revision_handler.py"
  ],
  "summary": "Executed 3 of 4 steps. Created: 0 files. Modified: 3 files. Issues: 1.",
  "issues_encountered": [
    "Step 4: Exit code 1"
  ]
}