{
  "task_id": "task-49D6EBCC",
  "executed_at": "2026-04-15T14:54:46Z",
  "branch_name": "task/task-49D6EBCC/update-planner-for-python-command-compatibility",
  "steps_completed": [
    {
      "step_id": 1,
      "status": "completed",
      "output": "Research notes generated (4143 chars)",
      "error": null
    },
    {
      "step_id": 2,
      "status": "completed",
      "output": "Written 9799 chars to planner codebase",
      "error": null
    },
    {
      "step_id": 3,
      "status": "completed",
      "output": "Research notes generated (4018 chars)",
      "error": null
    },
    {
      "step_id": 4,
      "status": "completed",
      "output": "Written 10690 chars to planner codebase",
      "error": null
    },
    {
      "step_id": 5,
      "status": "failed",
      "output": "\nSTDERR: 'test' is not recognized as an internal or external command,\noperable program or batch file.\n",
      "error": "Exit code 1"
    }
  ],
  "files_created": [],
  "files_modified": [
    "planner codebase",
    "planner codebase"
  ],
  "summary": "Executed 4 of 5 steps. Created: 0 files. Modified: 2 files. Issues: 1.",
  "issues_encountered": [
    "Step 5: Exit code 1"
  ]
}