{
  "task_id": "task-95BFE620",
  "executed_at": "2026-04-15T18:35:28Z",
  "branch_name": "task/task-95BFE620/enhance-planner-to-enforce-executable-shell-comman",
  "steps_completed": [
    {
      "step_id": 1,
      "status": "completed",
      "output": "Research notes generated (5869 chars)",
      "error": null
    },
    {
      "step_id": 2,
      "status": "completed",
      "output": "Written 16077 chars to path/to/planner_module.py",
      "error": null
    },
    {
      "step_id": 3,
      "status": "completed",
      "output": "Written 16235 chars to path/to/planner_module.py",
      "error": null
    },
    {
      "step_id": 4,
      "status": "failed",
      "output": "\nSTDERR: C:\\Users\\evhedric\\AppData\\Local\\Python\\pythoncore-3.14-64\\python.exe: No module named pytest\n",
      "error": "Exit code 1"
    },
    {
      "step_id": 5,
      "status": "completed",
      "output": "Written 6948 chars to docs/planner_updates.md",
      "error": null
    }
  ],
  "files_created": [],
  "files_modified": [
    "path/to/planner_module.py",
    "path/to/planner_module.py",
    "docs/planner_updates.md"
  ],
  "summary": "Executed 4 of 5 steps. Created: 0 files. Modified: 3 files. Issues: 1.",
  "issues_encountered": [
    "Step 4: Exit code 1"
  ]
}