{
  "task_id": "task-5EED5AC2",
  "executed_at": "2026-04-15T13:28:25Z",
  "branch_name": "task/task-5EED5AC2/refactor-reviewer-for-rule-based-approval-system",
  "steps_completed": [
    {
      "step_id": 1,
      "status": "completed",
      "output": "Research notes generated (4592 chars)",
      "error": null
    },
    {
      "step_id": 2,
      "status": "completed",
      "output": "Written 7588 chars to reviewer/rules.json",
      "error": null
    },
    {
      "step_id": 3,
      "status": "completed",
      "output": "Written 15583 chars to reviewer/reviewer.py",
      "error": null
    },
    {
      "step_id": 4,
      "status": "completed",
      "output": "Written 15583 chars to reviewer/reviewer.py",
      "error": null
    },
    {
      "step_id": 5,
      "status": "failed",
      "output": "\nSTDERR: 'pytest' is not recognized as an internal or external command,\noperable program or batch file.\n",
      "error": "Exit code 1"
    },
    {
      "step_id": 6,
      "status": "completed",
      "output": "Written 14759 chars to docs/reviewer_approval_system.md",
      "error": null
    }
  ],
  "files_created": [
    "reviewer/rules.json"
  ],
  "files_modified": [
    "reviewer/reviewer.py",
    "reviewer/reviewer.py",
    "docs/reviewer_approval_system.md"
  ],
  "summary": "Executed 5 of 6 steps. Created: 1 files. Modified: 3 files. Issues: 1.",
  "issues_encountered": [
    "Step 5: Exit code 1"
  ]
}