{
  "task_id": "task-F2D72004",
  "executed_at": "2026-04-15T19:05:25Z",
  "branch_name": "task/task-F2D72004/revise-planner-prompt-to-enforce-rule-based-struct",
  "steps_completed": [
    {
      "step_id": 1,
      "status": "completed",
      "output": "Research notes generated (17 chars)",
      "error": null
    },
    {
      "step_id": 2,
      "status": "completed",
      "output": "Written 3943 chars to path/to/planner_prompt_definition_file",
      "error": null
    },
    {
      "step_id": 3,
      "status": "completed",
      "output": "Written 3943 chars to path/to/planner_prompt_definition_file",
      "error": null
    },
    {
      "step_id": 4,
      "status": "completed",
      "output": "Written 3943 chars to path/to/planner_prompt_definition_file",
      "error": null
    },
    {
      "step_id": 5,
      "status": "failed",
      "output": "\nSTDERR: C:\\Users\\evhedric\\AppData\\Local\\Python\\pythoncore-3.14-64\\python.exe: No module named pytest\n",
      "error": "Exit code 1"
    }
  ],
  "files_created": [],
  "files_modified": [
    "path/to/planner_prompt_definition_file",
    "path/to/planner_prompt_definition_file",
    "path/to/planner_prompt_definition_file"
  ],
  "summary": "Executed 4 of 5 steps. Created: 0 files. Modified: 3 files. Issues: 1.",
  "issues_encountered": [
    "Step 5: Exit code 1"
  ]
}