{
  "task_id": "task-C3B27332",
  "executed_at": "2026-04-15T19:54:05Z",
  "branch_name": "task/task-C3B27332/enforce-plan-validation-before-command-execution",
  "steps_completed": [
    {
      "step_id": 1,
      "status": "completed",
      "output": "Written 444 chars to execution_wrapper.py",
      "error": null
    },
    {
      "step_id": 2,
      "status": "completed",
      "output": "Written 192 chars to main.py",
      "error": null
    },
    {
      "step_id": 3,
      "status": "completed",
      "output": "Written 2020 chars to README.md",
      "error": null
    }
  ],
  "files_created": [
    "execution_wrapper.py"
  ],
  "files_modified": [
    "main.py",
    "README.md"
  ],
  "summary": "Executed 3 of 3 steps. Created: 1 files. Modified: 2 files.",
  "issues_encountered": []
}