{
  "task_id": "task-6BE862AC",
  "executed_at": "2026-04-15T14:42:55Z",
  "branch_name": "task/task-6BE862AC/create-and-test-python-file-with-missing-dependenc",
  "steps_completed": [
    {
      "step_id": 1,
      "status": "completed",
      "output": "Written 150 chars to example.py",
      "error": null
    },
    {
      "step_id": 2,
      "status": "completed",
      "output": "Written 986 chars to test_example.py",
      "error": null
    },
    {
      "step_id": 3,
      "status": "failed",
      "output": "\nSTDERR: 'pytest' is not recognized as an internal or external command,\noperable program or batch file.\n",
      "error": "Exit code 1"
    },
    {
      "step_id": 4,
      "status": "completed",
      "output": "Requirement already satisfied: requests in C:\\Users\\evhedric\\AppData\\Local\\Python\\pythoncore-3.14-64\\Lib\\site-packages (2.33.1)\nRequirement already satisfied: charset_normalizer<4,>=2 in C:\\Users\\evhedric\\AppData\\Local\\Python\\pythoncore-3.14-64\\Lib\\site-packages (from requests) (3.4.7)\nRequirement already satisfied: idna<4,>=2.5 in C:\\Users\\evhedric\\AppData\\Local\\Python\\pythoncore-3.14-64\\Lib\\site-packages (from requests) (3.11)\nRequirement already satisfied: urllib3<3,>=1.26 in C:\\Users\\evhedri",
      "error": null
    },
    {
      "step_id": 5,
      "status": "failed",
      "output": "\nSTDERR: 'pytest' is not recognized as an internal or external command,\noperable program or batch file.\n",
      "error": "Exit code 1"
    },
    {
      "step_id": 6,
      "status": "completed",
      "output": "Written 6163 chars to PROCESS.md",
      "error": null
    }
  ],
  "files_created": [
    "example.py",
    "test_example.py"
  ],
  "files_modified": [
    "PROCESS.md"
  ],
  "summary": "Executed 4 of 6 steps. Created: 2 files. Modified: 1 files. Issues: 2.",
  "issues_encountered": [
    "Step 3: Exit code 1",
    "Step 5: Exit code 1"
  ]
}