{
  "task_id": "task-6C5C989C",
  "executed_at": "2026-04-15T12:43:32Z",
  "branch_name": "task/task-6C5C989C/enhance-reviewer-to-enforce-strict-quality-standar",
  "steps_completed": [
    {
      "step_id": 1,
      "status": "completed",
      "output": "Research notes generated (2243 chars)",
      "error": null
    },
    {
      "step_id": 2,
      "status": "completed",
      "output": "Written 15844 chars to path/to/reviewer_logic_file.ext",
      "error": null
    },
    {
      "step_id": 3,
      "status": "completed",
      "output": "Written 17026 chars to path/to/reviewer_logic_file.ext",
      "error": null
    },
    {
      "step_id": 4,
      "status": "failed",
      "output": "\nSTDERR: 'run' is not recognized as an internal or external command,\noperable program or batch file.\n",
      "error": "Exit code 1"
    },
    {
      "step_id": 5,
      "status": "completed",
      "output": "Written 8065 chars to docs/reviewer_logic_changes.md",
      "error": null
    }
  ],
  "files_created": [],
  "files_modified": [
    "path/to/reviewer_logic_file.ext",
    "path/to/reviewer_logic_file.ext",
    "docs/reviewer_logic_changes.md"
  ],
  "summary": "Executed 4 of 5 steps. Created: 0 files. Modified: 3 files. Issues: 1.",
  "issues_encountered": [
    "Step 4: Exit code 1"
  ]
}