{
  "task_id": "task-6C5A7B4D",
  "executed_at": "2026-04-15T18:59:36Z",
  "branch_name": "task/task-6C5A7B4D/enhance-planner-to-adapt-plans-based-on-execution-",
  "steps_completed": [
    {
      "step_id": 1,
      "status": "completed",
      "output": "Research notes generated (7242 chars)",
      "error": null
    },
    {
      "step_id": 2,
      "status": "completed",
      "output": "Written 15540 chars to docs/planner_adaptive_logic.md",
      "error": null
    },
    {
      "step_id": 3,
      "status": "completed",
      "output": "Written 16691 chars to src/planner.py",
      "error": null
    },
    {
      "step_id": 4,
      "status": "completed",
      "output": "Written 16691 chars to src/planner.py",
      "error": null
    },
    {
      "step_id": 5,
      "status": "completed",
      "output": "Written 16059 chars to tests/test_planner_adaptive_logic.py",
      "error": null
    },
    {
      "step_id": 6,
      "status": "failed",
      "output": "\nSTDERR: 'pytest' is not recognized as an internal or external command,\noperable program or batch file.\n",
      "error": "Exit code 1"
    },
    {
      "step_id": 7,
      "status": "completed",
      "output": "Written 15141 chars to docs/planner_overview.md",
      "error": null
    }
  ],
  "files_created": [
    "tests/test_planner_adaptive_logic.py"
  ],
  "files_modified": [
    "docs/planner_adaptive_logic.md",
    "src/planner.py",
    "src/planner.py",
    "docs/planner_overview.md"
  ],
  "summary": "Executed 6 of 7 steps. Created: 1 files. Modified: 4 files. Issues: 1.",
  "issues_encountered": [
    "Step 6: Exit code 1"
  ]
}