{
  "task_id": "task-34BE0BA7",
  "executed_at": "2026-04-15T19:12:50Z",
  "branch_name": "task/task-34BE0BA7/update-planner-prompt-to-enforce-python-m-pytest-f",
  "steps_completed": [
    {
      "step_id": 1,
      "status": "completed",
      "output": "Research notes generated (3037 chars)",
      "error": null
    },
    {
      "step_id": 2,
      "status": "completed",
      "output": "Written 3777 chars to path/to/planner_prompt_file",
      "error": null
    },
    {
      "step_id": 3,
      "status": "failed",
      "output": "\nSTDERR: 'command' is not recognized as an internal or external command,\noperable program or batch file.\n",
      "error": "Exit code 1"
    }
  ],
  "files_created": [],
  "files_modified": [
    "path/to/planner_prompt_file"
  ],
  "summary": "Executed 2 of 3 steps. Created: 0 files. Modified: 1 files. Issues: 1.",
  "issues_encountered": [
    "Step 3: Exit code 1"
  ]
}