{
  "task_id": "task-7E7461D5",
  "executed_at": "2026-04-15T11:39:16Z",
  "branch_name": "task/task-7E7461D5/review-and-enhance-readme-md-for-production-grade-",
  "steps_completed": [
    {
      "step_id": 1,
      "status": "completed",
      "output": "Research notes generated (5212 chars)",
      "error": null
    },
    {
      "step_id": 2,
      "status": "completed",
      "output": "Research notes generated (6991 chars)",
      "error": null
    },
    {
      "step_id": 3,
      "status": "completed",
      "output": "Written 10548 chars to README.md",
      "error": null
    }
  ],
  "files_created": [],
  "files_modified": [
    "README.md"
  ],
  "summary": "Executed 3 of 3 steps. Created: 0 files. Modified: 1 files.",
  "issues_encountered": []
}