{
  "task_id": "task-TEST0001",
  "executed_at": "2026-04-14T20:12:35Z",
  "branch_name": "task/task-TEST0001/generate-a-readme-for-system-architecture-and-usag",
  "steps_completed": [
    {
      "step_id": 1,
      "status": "completed",
      "output": "Written 4070 chars to README.md",
      "error": null
    },
    {
      "step_id": 2,
      "status": "completed",
      "output": "Written 5936 chars to README.md",
      "error": null
    },
    {
      "step_id": 3,
      "status": "completed",
      "output": "Written 6186 chars to README.md",
      "error": null
    },
    {
      "step_id": 4,
      "status": "completed",
      "output": "Written 8479 chars to README.md",
      "error": null
    },
    {
      "step_id": 5,
      "status": "completed",
      "output": "Written 8479 chars to README.md",
      "error": null
    }
  ],
  "files_created": [
    "README.md"
  ],
  "files_modified": [
    "README.md",
    "README.md",
    "README.md",
    "README.md"
  ],
  "summary": "Executed 5 of 5 steps. Created: 1 files. Modified: 4 files.",
  "issues_encountered": []
}