{
  "task_id": "task-64ED3B8D",
  "executed_at": "2026-04-15T14:26:51Z",
  "branch_name": "task/task-64ED3B8D/implement-environment-self-healing-in-executor",
  "steps_completed": [
    {
      "step_id": 1,
      "status": "completed",
      "output": "Research notes generated (4647 chars)",
      "error": null
    },
    {
      "step_id": 2,
      "status": "completed",
      "output": "Written 6412 chars to path/to/executor_file.py",
      "error": null
    },
    {
      "step_id": 3,
      "status": "completed",
      "output": "Written 7438 chars to path/to/executor_file.py",
      "error": null
    },
    {
      "step_id": 4,
      "status": "completed",
      "output": "Written 7896 chars to path/to/executor_file.py",
      "error": null
    },
    {
      "step_id": 5,
      "status": "completed",
      "output": "Written 11651 chars to path/to/executor_file.py",
      "error": null
    },
    {
      "step_id": 6,
      "status": "failed",
      "output": "\nSTDERR: 'pytest' is not recognized as an internal or external command,\noperable program or batch file.\n",
      "error": "Exit code 1"
    }
  ],
  "files_created": [],
  "files_modified": [
    "path/to/executor_file.py",
    "path/to/executor_file.py",
    "path/to/executor_file.py",
    "path/to/executor_file.py"
  ],
  "summary": "Executed 5 of 6 steps. Created: 0 files. Modified: 4 files. Issues: 1.",
  "issues_encountered": [
    "Step 6: Exit code 1"
  ]
}