{
  "task_id": "task-153169AE",
  "executed_at": "2026-04-15T19:19:56Z",
  "branch_name": "task/task-153169AE/update-planner-to-use-real-executable-commands",
  "steps_completed": [
    {
      "step_id": 1,
      "status": "completed",
      "output": "Research notes generated (3928 chars)",
      "error": null
    },
    {
      "step_id": 2,
      "status": "completed",
      "output": "Written 14347 chars to path/to/planner_code_file.ext",
      "error": null
    },
    {
      "step_id": 3,
      "status": "completed",
      "output": "Written 15041 chars to path/to/planner_code_file.ext",
      "error": null
    },
    {
      "step_id": 4,
      "status": "failed",
      "output": "\nSTDERR: 'command' is not recognized as an internal or external command,\noperable program or batch file.\n",
      "error": "Exit code 1"
    }
  ],
  "files_created": [],
  "files_modified": [
    "path/to/planner_code_file.ext",
    "path/to/planner_code_file.ext"
  ],
  "summary": "Executed 3 of 4 steps. Created: 0 files. Modified: 2 files. Issues: 1.",
  "issues_encountered": [
    "Step 4: Exit code 1"
  ]
}