{
  "task_id": "task-1F56C8CA",
  "executed_at": "2026-04-15T11:33:23Z",
  "branch_name": "task/task-1F56C8CA/enhance-the-clarity-and-structure-of-the-readme",
  "steps_completed": [
    {
      "step_id": 1,
      "status": "completed",
      "output": "Research notes generated (1241 chars)",
      "error": null
    },
    {
      "step_id": 2,
      "status": "completed",
      "output": "Research notes generated (3418 chars)",
      "error": null
    },
    {
      "step_id": 3,
      "status": "completed",
      "output": "Written 8416 chars to README.md",
      "error": null
    },
    {
      "step_id": 4,
      "status": "completed",
      "output": "Written 9482 chars to README.md",
      "error": null
    },
    {
      "step_id": 5,
      "status": "completed",
      "output": "Written 9491 chars to README.md",
      "error": null
    }
  ],
  "files_created": [],
  "files_modified": [
    "README.md",
    "README.md",
    "README.md"
  ],
  "summary": "Executed 5 of 5 steps. Created: 0 files. Modified: 3 files.",
  "issues_encountered": []
}